<?xml version="1.0" encoding="UTF-8"?>

<Party xmlns:xsi="http://www.w3.org/2001/XMLSchema-instance" xsi:noNamespaceSchemaLocation="party.xsd">
    <Character name="Obsidian Sundark">
        <HitPoints maximum="17"/>
        <Initiative value="5"/>
        <SavingThrows>
            <Save type="Fortitude" value="5"/>
            <Save type="Reflex" value="4"/>
            <Save type="Will" value="4"/>
        </SavingThrows>
        <Skills>
            <Skill type="Listen" value="5"/>
            <Skill type="Search" value="4"/>
            <Skill type="Knowledge (Arcana)" value="7"/>
            <Skill type="Knowledge (History)" value="6"/>
            <Skill type="Knowledge (Local)" value="6"/>
            <Skill type="Knowledge (Nobility)" value="6"/>
            <Skill type="Knowledge (Machinery)" value="8"/>
            <Skill type="Knowledge (Religion)" value="6"/>
            <Skill type="Knowledge (The Planes)" value="6"/>
            <Skill type="Spot" value="3"/>
            <Skill type="Knowledge (Dungeoneering)" value="7"/>
        </Skills>
        <AC>
            <ACComponent type="Dex" value="2"/>
            <ACComponent type="Size" value="1"/>
        </AC>
    </Character>
    <Character name="FitzLoyal">
        <HitPoints maximum="16"/>
        <Initiative value="0"/>
        <SavingThrows>
            <Save type="Fortitude" value="2"/>
            <Save type="Reflex" value="7"/>
            <Save type="Will" value="-1"/>
        </SavingThrows>
        <Skills>
            <Skill type="Listen" value="-1"/>
            <Skill type="Search" value="8"/>
            <Skill type="Knowledge (Local)" value="8"/>
            <Skill type="Gather Information" value="4"/>
            <Skill type="Spot" value="-1"/>
        </Skills>
        <AC>
            <ACComponent type="Armor" value="3"/>
            <ACComponent type="Shield" value="1"/>
            <ACComponent type="Dex" value="4"/>
        </AC>
    </Character>
    <Character name="Deadwood">
        <HitPoints maximum="18"/>
        <Initiative value="0"/>
        <SavingThrows>
            <Save type="Fortitude" value="5"/>
            <Save type="Reflex" value="2"/>
            <Save type="Will" value="6"/>
        </SavingThrows>
        <Skills>
            <Skill type="Listen" value="8"/>
            <Skill type="Gather Information" value="-2"/>
            <Skill type="Spot" value="9"/>
            <Skill type="Knowledge (Nature)" value="9"/>
        </Skills>
        <AC>
            <ACComponent type="Armor" value="2"/>
            <ACComponent type="Shield" value="1"/>
            <ACComponent type="Dex" value="2"/>
        </AC>
    </Character>
    <Character name="Select Vera">
        <HitPoints maximum="11"/>
        <Initiative value="0"/>
        <SavingThrows>
            <Save type="Fortitude" value="6"/>
            <Save type="Reflex" value="-1"/>
            <Save type="Will" value="1"/>
        </SavingThrows>
        <Skills>
            <Skill type="Listen" value="1"/>
            <Skill type="Search" value="1"/>
            <Skill type="Knowledge (Nobility)" value="6"/>
            <Skill type="Knowledge (Religion)" value="5"/>
            <Skill type="Gather Information" value="4"/>
            <Skill type="Spot" value="1"/>
        </Skills>
        <AC>
            <ACComponent type="Armor" value="4"/>
            <ACComponent type="Shield" value="2"/>
            <ACComponent type="Dex" value="-1"/>
        </AC>
    </Character>
    <Character name="Heidi Himmler">
        <HitPoints maximum="12"/>
        <Initiative value="0"/>
        <SavingThrows>
            <Save type="Fortitude" value="6"/>
            <Save type="Reflex" value="2"/>
            <Save type="Will" value="5"/>
        </SavingThrows>
        <Skills>
            <Skill type="Listen" value="3"/>
            <Skill type="Search" value="2"/>
            <Skill type="Spot" value="3"/>
        </Skills>
        <AC>
            <ACComponent type="Armor" value="4"/>
            <ACComponent type="Shield" value="2"/>
        </AC>
    </Character>
</Party>
