<?xml version="1.0" encoding="UTF-8"?>

<Party xmlns:xsi="http://www.w3.org/2001/XMLSchema-instance" xsi:noNamespaceSchemaLocation="party.xsd">
	<Character name="Deadwood &quot;The Uncaring One&quot;">
		<AbilityScores>
			<AbilityScore type="Strength" value="9"/>
			<AbilityScore type="Dexterity" value="14"/>
			<AbilityScore type="Constitution" value="15"/>
			<AbilityScore type="Intelligence" value="11"/>
			<AbilityScore type="Wisdom" value="18"/>
			<AbilityScore type="Charisma" value="7"/>
		</AbilityScores>
		<HitPoints maximum="50"/>
		<Initiative value="0"/>
		<SavingThrows>
			<Save type="Fortitude" value="6"/>
			<Save type="Reflex" value="3"/>
			<Save type="Will" value="6"/>
		</SavingThrows>
		<Skills>
			<Skill type="Balance" value="-3"/>
			<Skill type="Climb" value="-2"/>
			<Skill type="Craft (Woodworking)" value="1"/>
			<Skill type="Escape Artist" value="-3"/>
			<Skill type="Handle Animal" value="9"/>
			<Skill type="Hide" value="-3"/>
			<Skill type="Jump" value="-9"/>
			<Skill type="Knowledge (nature)" value="13"/>
			<Skill type="Listen" value="6"/>
			<Skill type="Move Silently" value="-3"/>
			<Skill type="Profession (Landscaping)" value="1"/>
			<Skill type="Ride" value="3"/>
			<Skill type="Spellcraft" value="4"/>
			<Skill type="Spot" value="6"/>
			<Skill type="Survival" value="7"/>
			<Skill type="Swim" value="-5"/>
		</Skills>
		<AC>
			<ACComponent type="Armor" value="2"/>
			<ACComponent type="Shield" value="1"/>
			<ACComponent type="Dex" value="2"/>
		</AC>
	</Character>
</Party>
